<?xml version="1.0" encoding="UTF-8"?>
<?xml-stylesheet type="text/css" href="employee.css"?>
<employees xmlns:xsi="http://www.w3.org/2001/XMLSchema-instance"
 xsi:noNamespaceSchemaLocation="employee.xsd">

<employee name ="ahmed" e-mail = "ahmed@gmail.com" >
    <phones>
    <phone type = "home">
    01226723732
    </phone>
    </phones>
    <address>
    <region>
        middle east
    </region>
    <city>
    alex
    </city>
    <country>
    Egypt
    </country>
    <building_number>
    
    22
    </building_number>
    </address>

</employee>

<employee name ="ahmed" e-mail = "ahmed@gmail.com" >
    <phones>
    <phone type = "home">
    01326723732
    </phone>
    </phones>
    <address>
    <region>
        middle east
    </region>
    <city>
    cairo
    </city>
    <country>
    Egypt
    </country>
    <building_number>
    
    12
    </building_number>
    </address>

</employee>

</employees>